{
  "$schema": "https://github.com/kobesoft-inc/jp-phone-number-db/releases/latest/download/jp_phone_number.schema.json",
  "format": 1,
  "version": "2026-09-01",
  "generatedAt": "2026-09-23T10:39:09Z",
  "source": {
    "publisher": "総務省",
    "title": "電気通信番号指定状況（電気通信番号計画（令和元年総務省告示第6号）第1第4項による公表）",
    "page": "https://www.soumu.go.jp/main_sosiki/joho_tsusin/top/tel_number/number_shitei.html",
    "asOf": "2026-09-01",
    "license": "公共データ利用規約（第1.0版）",
    "licenseUrl": "https://www.digital.go.jp/resources/open_data/public_data_license_v1.0",
    "credit": "「電気通信番号指定状況」（総務省）（https://www.soumu.go.jp/main_sosiki/joho_tsusin/top/tel_number/number_shitei.html）を加工して作成",
    "files": [
      {
        "title": "1から始まる市外局番",
        "url": "https://www.soumu.go.jp/main_content/000697543.xls",
        "asOf": "令和6年9月1日現在",
        "date": "2024-09-01",
        "rows": 4410
      },
      {
        "title": "2から始まる市外局番",
        "url": "https://www.soumu.go.jp/main_content/000697544.xls",
        "asOf": "令和7年1月1日現在",
        "date": "2025-01-01",
        "rows": 5668
      },
      {
        "title": "3から始まる市外局番",
        "url": "https://www.soumu.go.jp/main_content/000697545.xls",
        "asOf": "令和6年3月1日現在",
        "date": "2024-03-01",
        "rows": 3200
      },
      {
        "title": "4から始まる市外局番",
        "url": "https://www.soumu.go.jp/main_content/000697546.xls",
        "asOf": "令和5年7月1日現在",
        "date": "2023-07-01",
        "rows": 5327
      },
      {
        "title": "5から始まる市外局番",
        "url": "https://www.soumu.go.jp/main_content/000697548.xls",
        "asOf": "令和5年7月1日現在",
        "date": "2023-07-01",
        "rows": 5299
      },
      {
        "title": "6から始まる市外局番",
        "url": "https://www.soumu.go.jp/main_content/000697549.xls",
        "asOf": "令和5年7月1日現在",
        "date": "2023-07-01",
        "rows": 2700
      },
      {
        "title": "7から始まる市外局番",
        "url": "https://www.soumu.go.jp/main_content/000697550.xls",
        "asOf": "令和5年7月1日現在",
        "date": "2023-07-01",
        "rows": 5544
      },
      {
        "title": "8から始まる市外局番",
        "url": "https://www.soumu.go.jp/main_content/000697551.xls",
        "asOf": "令和5年7月1日現在",
        "date": "2023-07-01",
        "rows": 4519
      },
      {
        "title": "9から始まる市外局番",
        "url": "https://www.soumu.go.jp/main_content/001090880.xls",
        "asOf": "令和8年9月1日現在",
        "date": "2026-09-01",
        "rows": 5320
      }
    ],
    "rows": 41987
  },
  "services": [
    {
      "prefix": "060",
      "kind": "mobile",
      "label": "携帯電話",
      "length": 11,
      "groups": [
        3,
        4,
        4
      ],
      "designated": true
    },
    {
      "prefix": "070",
      "kind": "mobile",
      "label": "携帯電話・PHS",
      "length": 11,
      "groups": [
        3,
        4,
        4
      ],
      "designated": true
    },
    {
      "prefix": "080",
      "kind": "mobile",
      "label": "携帯電話",
      "length": 11,
      "groups": [
        3,
        4,
        4
      ],
      "designated": true
    },
    {
      "prefix": "090",
      "kind": "mobile",
      "label": "携帯電話",
      "length": 11,
      "groups": [
        3,
        4,
        4
      ],
      "designated": true
    },
    {
      "prefix": "050",
      "kind": "ip",
      "label": "IP 電話",
      "length": 11,
      "groups": [
        3,
        4,
        4
      ],
      "designated": true
    },
    {
      "prefix": "020",
      "kind": "m2m",
      "label": "データ通信（M2M）",
      "length": 11,
      "groups": [
        3,
        4,
        4
      ],
      "designated": true
    },
    {
      "prefix": "0200",
      "kind": "m2m",
      "label": "データ通信（M2M・14 桁）",
      "length": 14,
      "groups": [
        4,
        5,
        5
      ],
      "designated": true
    },
    {
      "prefix": "0120",
      "kind": "toll_free",
      "label": "フリーダイヤル",
      "length": 10,
      "groups": [
        4,
        3,
        3
      ],
      "designated": true
    },
    {
      "prefix": "0800",
      "kind": "toll_free",
      "label": "フリーダイヤル",
      "length": 11,
      "groups": [
        4,
        3,
        4
      ],
      "designated": true
    },
    {
      "prefix": "0570",
      "kind": "shared_cost",
      "label": "ナビダイヤル",
      "length": 10,
      "groups": [
        4,
        3,
        3
      ],
      "designated": true
    },
    {
      "prefix": "0180",
      "kind": "mass_calling",
      "label": "テレドーム",
      "length": 10,
      "groups": [
        4,
        3,
        3
      ],
      "designated": false
    },
    {
      "prefix": "0990",
      "kind": "premium",
      "label": "情報料代理徴収",
      "length": 10,
      "groups": [
        4,
        3,
        3
      ],
      "designated": true
    }
  ],
  "fixed": {
    "kind": "fixed",
    "label": "固定電話",
    "length": 10,
    "subscriberFirstDigits": "123456789",
    "areaCodes": [
      "011",
      "0123",
      "0124",
      "0125",
      "0126",
      "01267",
      "0133",
      "0134",
      "0135",
      "0136",
      "0137",
      "01372",
      "01374",
      "01377",
      "0138",
      "0139",
      "01392",
      "01397",
      "01398",
      "0142",
      "0143",
      "0144",
      "0145",
      "01456",
      "01457",
      "0146",
      "01466",
      "015",
      "0152",
      "0153",
      "0154",
      "01547",
      "0155",
      "01558",
      "0156",
      "01564",
      "0157",
      "0158",
      "01586",
      "01587",
      "0162",
      "0163",
      "01632",
      "01634",
      "01635",
      "0164",
      "01648",
      "0165",
      "01654",
      "01655",
      "01656",
      "01658",
      "0166",
      "0167",
      "017",
      "0172",
      "0173",
      "0174",
      "0175",
      "0176",
      "0178",
      "0179",
      "018",
      "0182",
      "0183",
      "0184",
      "0185",
      "0186",
      "0187",
      "019",
      "0191",
      "0192",
      "0193",
      "0194",
      "0195",
      "0197",
      "0198",
      "022",
      "0220",
      "0223",
      "0224",
      "0225",
      "0226",
      "0228",
      "0229",
      "023",
      "0233",
      "0234",
      "0235",
      "0237",
      "0238",
      "024",
      "0240",
      "0241",
      "0242",
      "0243",
      "0244",
      "0246",
      "0247",
      "0248",
      "025",
      "0250",
      "0254",
      "0255",
      "0256",
      "0257",
      "0258",
      "0259",
      "026",
      "0260",
      "0261",
      "0263",
      "0264",
      "0265",
      "0266",
      "0267",
      "0268",
      "0269",
      "027",
      "0270",
      "0274",
      "0276",
      "0277",
      "0278",
      "0279",
      "028",
      "0280",
      "0282",
      "0283",
      "0284",
      "0285",
      "0287",
      "0288",
      "0289",
      "029",
      "0291",
      "0293",
      "0294",
      "0295",
      "0296",
      "0297",
      "0299",
      "03",
      "04",
      "042",
      "0422",
      "0428",
      "043",
      "0436",
      "0438",
      "0439",
      "044",
      "045",
      "046",
      "0460",
      "0463",
      "0465",
      "0466",
      "0467",
      "047",
      "0470",
      "0475",
      "0476",
      "0478",
      "0479",
      "048",
      "0480",
      "049",
      "0493",
      "0494",
      "0495",
      "04992",
      "04994",
      "04996",
      "04998",
      "052",
      "053",
      "0531",
      "0532",
      "0533",
      "0536",
      "0537",
      "0538",
      "0539",
      "054",
      "0544",
      "0545",
      "0547",
      "0548",
      "055",
      "0550",
      "0551",
      "0553",
      "0554",
      "0555",
      "0556",
      "0557",
      "0558",
      "0561",
      "0562",
      "0563",
      "0564",
      "0565",
      "0566",
      "0567",
      "0568",
      "0569",
      "0572",
      "0573",
      "0574",
      "0575",
      "0576",
      "05769",
      "0577",
      "0578",
      "058",
      "0581",
      "0584",
      "0585",
      "0586",
      "0587",
      "059",
      "0594",
      "0595",
      "0596",
      "0597",
      "05979",
      "0598",
      "0599",
      "06",
      "072",
      "0721",
      "0725",
      "073",
      "0735",
      "0736",
      "0737",
      "0738",
      "0739",
      "0740",
      "0742",
      "0743",
      "0744",
      "0745",
      "0746",
      "07468",
      "0747",
      "0748",
      "0749",
      "075",
      "076",
      "0761",
      "0763",
      "0765",
      "0766",
      "0767",
      "0768",
      "077",
      "0770",
      "0771",
      "0772",
      "0773",
      "0774",
      "0776",
      "0778",
      "0779",
      "078",
      "079",
      "0790",
      "0791",
      "0794",
      "0795",
      "0796",
      "0797",
      "0798",
      "0799",
      "082",
      "0820",
      "0823",
      "0824",
      "0826",
      "0827",
      "0829",
      "083",
      "0833",
      "0834",
      "0835",
      "0836",
      "0837",
      "0838",
      "08387",
      "08388",
      "08396",
      "084",
      "0845",
      "0846",
      "0847",
      "08477",
      "0848",
      "08512",
      "08514",
      "0852",
      "0853",
      "0854",
      "0855",
      "0856",
      "0857",
      "0858",
      "0859",
      "086",
      "0863",
      "0865",
      "0866",
      "0867",
      "0868",
      "0869",
      "087",
      "0875",
      "0877",
      "0879",
      "088",
      "0880",
      "0883",
      "0884",
      "0885",
      "0887",
      "0889",
      "089",
      "0892",
      "0893",
      "0894",
      "0895",
      "0896",
      "0897",
      "0898",
      "092",
      "0920",
      "093",
      "0930",
      "0940",
      "0942",
      "0943",
      "0944",
      "0946",
      "0947",
      "0948",
      "0949",
      "095",
      "0950",
      "0952",
      "0954",
      "0955",
      "0956",
      "0957",
      "0959",
      "096",
      "0964",
      "0965",
      "0966",
      "0967",
      "0968",